{
  "schemaVersion": "ventus_release_evidence_manifest/v1",
  "release": {
    "releaseId": "bank-review-staging-2026-08-01",
    "environmentClass": "bank_review_staging",
    "createdAt": "2026-08-02T14:58:17Z",
    "repository": "VentusCard/ventus-ai",
    "reviewedCommit": "d225e3482004fccc1127f36b02cd9a4dd8180110",
    "reviewerState": {
      "status": "pending",
      "releaseOwner": null,
      "independentReviewer": null
    }
  },
  "frontend": {
    "url": "https://staging.d1gaewa028qzng.amplifyapp.com",
    "amplify": {
      "appId": "d1gaewa028qzng",
      "branch": "staging",
      "jobId": "15"
    },
    "deployedCommit": "d225e3482004fccc1127f36b02cd9a4dd8180110",
    "buildArtifactDigest": "sha256:fbe4cb0ea38330e14609d866f65d5a05f0d4dd509f48b132d3d4dcfe8d2b8b97",
    "buildResult": "success",
    "observedAt": "2026-08-02T14:39:44.940Z"
  },
  "api": {
    "baseUrl": "https://6iaouncicd.execute-api.us-east-2.amazonaws.com/staging/v1/console",
    "stage": "staging",
    "account": "373633008995",
    "region": "us-east-2",
    "stack": "VentusConsoleApiStack",
    "deployRunId": "30752697397",
    "deployedCommit": "d225e3482004fccc1127f36b02cd9a4dd8180110",
    "artifactDigests": [
      {
        "name": "cdk-staging-diff",
        "digest": "sha256:bcbfe5d0a6dad71aebac3dc82e62ddff4b71349c172aef0e382d8b42278eb69d"
      }
    ],
    "deployStatus": "success",
    "observedAt": "2026-08-02T14:47:18Z"
  },
  "publicConfiguration": {
    "apiTarget": {
      "valueDigest": "sha256:4a7fcdc7efcd66e15e3778a8d135fa594bb1b3c0ad4e872c0b7c4121e93b4e9e"
    },
    "identityTarget": {
      "valueDigest": null
    },
    "enabledFlags": [],
    "corsOrigins": [],
    "configurationDigest": null
  },
  "identityAuthorization": {
    "userPool": {
      "idDigest": "sha256:48ca83cf220064d9283a449cbce41f4f33a40b9a35b1f99747cfe45505f243ae",
      "issuerDigest": "sha256:94d8eb98629065c3a769f1599a06d17752d22ddfdd931c178e1e80a75b744f90"
    },
    "clientIdDigest": "sha256:7d943386014b072737ccb6807aa1ae3ad901056f66e5c2fb03132eabe978d84d",
    "membershipSchemaVersion": "institution-access-v1",
    "sixRoleReceipt": {
      "id": null,
      "digest": null,
      "result": "unknown"
    },
    "deniedOperationReceipt": {
      "id": null,
      "digest": null,
      "result": "unknown"
    }
  },
  "dataPlane": {
    "stacks": [
      "VentusEvidenceStoreStack",
      "VentusConsoleApiStack"
    ],
    "migration": {
      "count": 12,
      "digests": [
        {
          "file": "decision-ledger.sql",
          "sha256": "0694489c5e40fcc8d4f7120744b152554e146c2c54454aaa77ced3f104be204c"
        },
        {
          "file": "experiment-measurement.sql",
          "sha256": "69594dce9e17952c5b34ca052bf42302ec8f77d59013d772f98209519d1f0f54"
        },
        {
          "file": "connected-expansion-measurement.sql",
          "sha256": "de6edd75ead8398c72255e298ff8790defe127c36adb43cd1ec7c4b939997c98"
        },
        {
          "file": "growth-play-registry.sql",
          "sha256": "8ac40cc000911a3b1f75317e79463aeaa7cab03e0ba7aafeeb04ac5848dc5e04"
        },
        {
          "file": "tenant-isolation.sql",
          "sha256": "a8d3479930e7b474c637801a92f252d8e22ca5402eebc26108e0388a669b99c4"
        },
        {
          "file": "institution-access.sql",
          "sha256": "b85e8018b7cb3ff2f5e804902dfc9ecc333a1b84adf0bcb705e5fc046f11a800"
        },
        {
          "file": "enterprise-access-phase0.sql",
          "sha256": "55af23accbe19113e7e0dd932fe37b43fb3ad0cca35b6aa1598180c35354e2c6"
        },
        {
          "file": "connector-delivery.sql",
          "sha256": "e5abcf88d9a1e03e77109dcfcfd31c815d59fa629bf772f296ca26ce6718bab7"
        },
        {
          "file": "enterprise-console-journey.sql",
          "sha256": "d4b5c02c8de090ccfafff3339f2f995718754afea2243dbd2f02b261d03afb93"
        },
        {
          "file": "enterprise-product-control-plane.sql",
          "sha256": "9e2a8e944faefd0f740da97501cc8f9fee632329537976ab63f2d9fcb4c40b9"
        },
        {
          "file": "enterprise-skill-governance.sql",
          "sha256": "ab86a299feb79f8cd318d123825f4ff3d2139ca26bb716aa79fd2c41bc49416f"
        },
        {
          "file": "enterprise-protocol-writer.sql",
          "sha256": "37cc984b592d777ca58dfed1fb8958085073bfceb65b92a96b4946ba48021401"
        }
      ]
    },
    "schemaInventory": [
      "connected_exposure_events",
      "connector_delivery_receipts",
      "connector_mapping_test_receipts",
      "connector_mapping_versions",
      "decision_ledger_events",
      "experiment_assignments",
      "growth_play_drafts",
      "growth_play_protocol_approval_events",
      "growth_play_protocols",
      "institution_identity_providers",
      "institution_memberships",
      "institutions",
      "outcome_events",
      "outcome_observation_receipts",
      "skill_shadow_approval_receipts",
      "skill_shadow_registry",
      "skill_shadow_transition_receipts"
    ],
    "runtimeRole": "ventus_evidence_app_v1",
    "forcedRlsNonBypass": true,
    "ledger": {
      "headHash": "sha256:ebf1b6cb073fcf43afa71afabc69f9b7397d5f530c60df30772c5c4929811394",
      "verified": true
    },
    "observedAt": "2026-08-01T19:37:35Z",
    "stagingAcceptanceReceipt": {
      "uri": "https://github.com/VentusCard/ventus-ai/blob/staging/docs/evidence/staging-acceptance-2026-08-01.json",
      "digest": "sha256:40f226fd4ee614a948c3f88066ba5c0e2a766c2eca4c7a7b12426d72136ee426",
      "sourceCommit": "2bb214403af1a9d051879d79af5b8637b031fa0d",
      "recordedAt": "2026-08-01T19:37:35Z"
    },
    "backupRestoreReceipt": {
      "uri": "https://github.com/VentusCard/ventus-ai/blob/staging/docs/evidence/backup-restore-receipt-2026-08-01.json",
      "digest": "sha256:3c7c7d1d0fe06cab7734c13952e79cc16cb7386e0d4076c22b0bcffa9a14467b",
      "status": "blocked_external_dependency",
      "recordedAt": "2026-08-01T23:45:00-05:00"
    }
  },
  "integrations": [
    {
      "name": "salesforce-fsc",
      "environment": "sandbox",
      "mappingVersion": null,
      "credentialMetadataRef": null,
      "healthReceiptId": null,
      "deliveryReceiptId": null,
      "reconciliationReceiptId": null,
      "status": "unknown"
    },
    {
      "name": "plaid-sandbox",
      "environment": "sandbox",
      "mappingVersion": null,
      "credentialMetadataRef": null,
      "healthReceiptId": null,
      "deliveryReceiptId": null,
      "reconciliationReceiptId": null,
      "status": "unknown"
    }
  ],
  "productContract": {
    "decisionPackageVersion": "1.2",
    "decisionPackageDigest": null,
    "approvedProtocols": [],
    "deterministicVersion": null,
    "skills": []
  },
  "acceptance": [
    {
      "rowId": "A1",
      "result": "open",
      "artifact": {
        "uri": null,
        "digest": null
      },
      "actor": null,
      "timestamp": null
    },
    {
      "rowId": "A2",
      "result": "open",
      "artifact": {
        "uri": "https://github.com/VentusCard/ventus-ai/blob/staging/docs/evidence/staging-acceptance-2026-08-01.json",
        "digest": "sha256:40f226fd4ee614a948c3f88066ba5c0e2a766c2eca4c7a7b12426d72136ee426"
      },
      "actor": "staging-acceptance-receipt",
      "timestamp": "2026-08-01T19:37:35Z"
    },
    {
      "rowId": "A3",
      "result": "open",
      "artifact": {
        "uri": "https://github.com/VentusCard/ventus-ai/blob/staging/docs/evidence/staging-acceptance-2026-08-01.json",
        "digest": "sha256:40f226fd4ee614a948c3f88066ba5c0e2a766c2eca4c7a7b12426d72136ee426"
      },
      "actor": "staging-acceptance-receipt",
      "timestamp": "2026-08-01T19:37:35Z"
    },
    {
      "rowId": "A4",
      "result": "open",
      "artifact": {
        "uri": null,
        "digest": null
      },
      "actor": null,
      "timestamp": null
    },
    {
      "rowId": "A5",
      "result": "open",
      "artifact": {
        "uri": null,
        "digest": null
      },
      "actor": null,
      "timestamp": null
    },
    {
      "rowId": "A6",
      "result": "open",
      "artifact": {
        "uri": null,
        "digest": null
      },
      "actor": null,
      "timestamp": null
    },
    {
      "rowId": "A7",
      "result": "open",
      "artifact": {
        "uri": "https://github.com/VentusCard/ventus-ai/blob/staging/docs/evidence/staging-acceptance-2026-08-01.json",
        "digest": "sha256:40f226fd4ee614a948c3f88066ba5c0e2a766c2eca4c7a7b12426d72136ee426"
      },
      "actor": "staging-acceptance-receipt",
      "timestamp": "2026-08-01T19:37:35Z"
    },
    {
      "rowId": "A8",
      "result": "open",
      "artifact": {
        "uri": null,
        "digest": null
      },
      "actor": null,
      "timestamp": null
    },
    {
      "rowId": "A9",
      "result": "open",
      "artifact": {
        "uri": null,
        "digest": null
      },
      "actor": null,
      "timestamp": null
    },
    {
      "rowId": "A10",
      "result": "open",
      "artifact": {
        "uri": null,
        "digest": null
      },
      "actor": null,
      "timestamp": null
    },
    {
      "rowId": "A11",
      "result": "open",
      "artifact": {
        "uri": null,
        "digest": null
      },
      "actor": null,
      "timestamp": null
    },
    {
      "rowId": "A12",
      "result": "open",
      "artifact": {
        "uri": null,
        "digest": null
      },
      "actor": null,
      "timestamp": null
    },
    {
      "rowId": "A13",
      "result": "open",
      "artifact": {
        "uri": null,
        "digest": null
      },
      "actor": null,
      "timestamp": null
    }
  ],
  "claims": {
    "evidenceClass": "partner_sandbox",
    "measurementStatus": "not_ready",
    "claimStatus": "not_bank_review_ready",
    "businessClaimAllowed": false,
    "causalClaimAllowed": false,
    "prohibitedWording": [
      "bank performance",
      "causal lift",
      "production readiness"
    ],